{
  "schema_version": "0.1.0",
  "snapshot_id": "current-github-census-2026-09-22",
  "observed_on": "2026-09-22",
  "scope": "Loofy147 repositories visible through current connected GitHub search",
  "search_method": {
    "query": "user:Loofy147",
    "pages": [
      1,
      2,
      3,
      4,
      5
    ],
    "counts": [
      {
        "page": 1,
        "count": 100
      },
      {
        "page": 2,
        "count": 100
      },
      {
        "page": 3,
        "count": 100
      },
      {
        "page": 4,
        "count": 39
      },
      {
        "page": 5,
        "count": 0
      }
    ],
    "total": 339
  },
  "installed_search_method": {
    "query": "user:Loofy147",
    "pages": [
      1,
      2,
      3,
      4,
      5
    ],
    "counts": [
      {
        "page": 1,
        "count": 100
      },
      {
        "page": 2,
        "count": 100
      },
      {
        "page": 3,
        "count": 100
      },
      {
        "page": 4,
        "count": 39
      },
      {
        "page": 5,
        "count": 0
      }
    ],
    "total": 339
  },
  "reconciliation": {
    "exact_set_match": true,
    "search_only": [],
    "installed_only": [],
    "prior_inventory_count": 319,
    "prior_inventory_overlap": 319,
    "newly_observed_count": 20
  },
  "repositories": [
    {
      "repository_full_name": "Loofy147/Scraper",
      "identity": {
        "name": "Scraper",
        "owner": "Loofy147",
        "visibility": "private",
        "default_branch": "feat/developer-resources-explorer",
        "archived": false,
        "size_kb": 12
      }
    },
    {
      "repository_full_name": "Loofy147/Gptscraper",
      "identity": {
        "name": "Gptscraper",
        "owner": "Loofy147",
        "visibility": "private",
        "default_branch": "main",
        "archived": false,
        "size_kb": 0
      }
    },
    {
      "repository_full_name": "Loofy147/socials",
      "identity": {
        "name": "socials",
        "owner": "Loofy147",
        "visibility": "private",
        "default_branch": "main",
        "archived": false,
        "size_kb": 82
      }
    },
    {
      "repository_full_name": "Loofy147/Bravolino",
      "identity": {
        "name": "Bravolino",
        "owner": "Loofy147",
        "visibility": "private",
        "default_branch": "main",
        "archived": false,
        "size_kb": 31327
      }
    },
    {
      "repository_full_name": "Loofy147/Smart-bot",
      "identity": {
        "name": "Smart-bot",
        "owner": "Loofy147",
        "visibility": "private",
        "default_branch": "main",
        "archived": false,
        "size_kb": 23
      }
    },
    {
      "repository_full_name": "Loofy147/Drogon",
      "identity": {
        "name": "Drogon",
        "owner": "Loofy147",
        "visibility": "private",
        "default_branch": "feature/autorevenue-agent",
        "archived": false,
        "size_kb": 5001
      }
    },
    {
      "repository_full_name": "Loofy147/ClimateNow",
      "identity": {
        "name": "ClimateNow",
        "owner": "Loofy147",
        "visibility": "private",
        "default_branch": "feat/initial-project-setup",
        "archived": false,
        "size_kb": 176
      }
    },
    {
      "repository_full_name": "Loofy147/ai-meta-orchestrator",
      "identity": {
        "name": "ai-meta-orchestrator",
        "owner": "Loofy147",
        "visibility": "private",
        "default_branch": "main",
        "archived": false,
        "size_kb": 132
      }
    },
    {
      "repository_full_name": "Loofy147/smart-delivery-plat",
      "identity": {
        "name": "smart-delivery-plat",
        "owner": "Loofy147",
        "visibility": "private",
        "default_branch": "main",
        "archived": false,
        "size_kb": 0
      }
    },
    {
      "repository_full_name": "Loofy147/A-louer",
      "identity": {
        "name": "A-louer",
        "owner": "Loofy147",
        "visibility": "private",
        "default_branch": "main",
        "archived": false,
        "size_kb": 289
      }
    },
    {
      "repository_full_name": "Loofy147/gemini-cli",
      "identity": {
        "name": "gemini-cli",
        "owner": "Loofy147",
        "visibility": "public",
        "default_branch": "main",
        "archived": false,
        "size_kb": 23013
      }
    },
    {
      "repository_full_name": "Loofy147/termux-alo",
      "identity": {
        "name": "termux-alo",
        "owner": "Loofy147",
        "visibility": "private",
        "default_branch": "master",
        "archived": false,
        "size_kb": 82
      }
    },
    {
      "repository_full_name": "Loofy147/hichem-project",
      "identity": {
        "name": "hichem-project",
        "owner": "Loofy147",
        "visibility": "private",
        "default_branch": "main",
        "archived": false,
        "size_kb": 228
      }
    },
    {
      "repository_full_name": "Loofy147/CloudCostGuard",
      "identity": {
        "name": "CloudCostGuard",
        "owner": "Loofy147",
        "visibility": "private",
        "default_branch": "main",
        "archived": false,
        "size_kb": 296
      }
    },
    {
      "repository_full_name": "Loofy147/studio",
      "identity": {
        "name": "studio",
        "owner": "Loofy147",
        "visibility": "private",
        "default_branch": "master",
        "archived": false,
        "size_kb": 559
      }
    },
    {
      "repository_full_name": "Loofy147/training-home",
      "identity": {
        "name": "training-home",
        "owner": "Loofy147",
        "visibility": "private",
        "default_branch": "main",
        "archived": false,
        "size_kb": 5939
      }
    },
    {
      "repository_full_name": "Loofy147/Slack-bot",
      "identity": {
        "name": "Slack-bot",
        "owner": "Loofy147",
        "visibility": "private",
        "default_branch": "main",
        "archived": false,
        "size_kb": 176
      }
    },
    {
      "repository_full_name": "Loofy147/Rust",
      "identity": {
        "name": "Rust",
        "owner": "Loofy147",
        "visibility": "private",
        "default_branch": "main",
        "archived": false,
        "size_kb": 162335
      }
    },
    {
      "repository_full_name": "Loofy147/Doha-platform-",
      "identity": {
        "name": "Doha-platform-",
        "owner": "Loofy147",
        "visibility": "private",
        "default_branch": "main",
        "archived": false,
        "size_kb": 28380
      }
    },
    {
      "repository_full_name": "Loofy147/Ai",
      "identity": {
        "name": "Ai",
        "owner": "Loofy147",
        "visibility": "private",
        "default_branch": "main",
        "archived": false,
        "size_kb": 1302
      }
    },
    {
      "repository_full_name": "Loofy147/Viral",
      "identity": {
        "name": "Viral",
        "owner": "Loofy147",
        "visibility": "private",
        "default_branch": "main",
        "archived": false,
        "size_kb": 116
      }
    },
    {
      "repository_full_name": "Loofy147/Django",
      "identity": {
        "name": "Django",
        "owner": "Loofy147",
        "visibility": "private",
        "default_branch": "main",
        "archived": false,
        "size_kb": 1349
      }
    },
    {
      "repository_full_name": "Loofy147/Larouine",
      "identity": {
        "name": "Larouine",
        "owner": "Loofy147",
        "visibility": "private",
        "default_branch": "master",
        "archived": false,
        "size_kb": 143
      }
    },
    {
      "repository_full_name": "Loofy147/-ducation-",
      "identity": {
        "name": "-ducation-",
        "owner": "Loofy147",
        "visibility": "private",
        "default_branch": "main",
        "archived": false,
        "size_kb": 98
      }
    },
    {
      "repository_full_name": "Loofy147/Laika",
      "identity": {
        "name": "Laika",
        "owner": "Loofy147",
        "visibility": "private",
        "default_branch": "main",
        "archived": false,
        "size_kb": 218
      }
    },
    {
      "repository_full_name": "Loofy147/E-commercedz",
      "identity": {
        "name": "E-commercedz",
        "owner": "Loofy147",
        "visibility": "private",
        "default_branch": "main",
        "archived": false,
        "size_kb": 0
      }
    },
    {
      "repository_full_name": "Loofy147/Doha-platform",
      "identity": {
        "name": "Doha-platform",
        "owner": "Loofy147",
        "visibility": "private",
        "default_branch": "main",
        "archived": false,
        "size_kb": 28330
      }
    },
    {
      "repository_full_name": "Loofy147/context7",
      "identity": {
        "name": "context7",
        "owner": "Loofy147",
        "visibility": "public",
        "default_branch": "master",
        "archived": false,
        "size_kb": 266
      }
    },
    {
      "repository_full_name": "Loofy147/Trendz",
      "identity": {
        "name": "Trendz",
        "owner": "Loofy147",
        "visibility": "private",
        "default_branch": "main",
        "archived": false,
        "size_kb": 796
      }
    },
    {
      "repository_full_name": "Loofy147/DernAi",
      "identity": {
        "name": "DernAi",
        "owner": "Loofy147",
        "visibility": "private",
        "default_branch": "main",
        "archived": false,
        "size_kb": 0
      }
    },
    {
      "repository_full_name": "Loofy147/ACE-Agentic-Context-Engineering",
      "identity": {
        "name": "ACE-Agentic-Context-Engineering",
        "owner": "Loofy147",
        "visibility": "private",
        "default_branch": "main",
        "archived": false,
        "size_kb": 137
      }
    },
    {
      "repository_full_name": "Loofy147/E-commerce-Alg-rie-",
      "identity": {
        "name": "E-commerce-Alg-rie-",
        "owner": "Loofy147",
        "visibility": "private",
        "default_branch": "main",